{
  "artifact_id": "V0_IPEC_WP4_OUTCOME_BINDING_REGISTRY",
  "contract_id": "V0-IPEC-0.1",
  "version": "0.1",
  "date": "2026-07-19",
  "status": "WP4_OUTCOME_BINDINGS_FROZEN",
  "rule_binding_count": 36,
  "procedural_binding_count": 11,
  "rule_bindings": [
    {
      "rule_id": "IPEC.RULE.GUARD.001",
      "theorem_id": "T121",
      "on_violation_outcome": "REJECTED_GUARD_FAILURE",
      "binding_basis": "WP4 total violation-to-outcome classification over the frozen 36-rule WP3 crosswalk.",
      "conditional": false
    },
    {
      "rule_id": "IPEC.RULE.PREREQUISITE.001",
      "theorem_id": "T122",
      "on_violation_outcome": "REJECTED_GUARD_FAILURE",
      "binding_basis": "WP4 total violation-to-outcome classification over the frozen 36-rule WP3 crosswalk.",
      "conditional": false
    },
    {
      "rule_id": "IPEC.RULE.DLE.001",
      "theorem_id": "T123",
      "on_violation_outcome": "REJECTED_DLE_FAILURE",
      "binding_basis": "WP4 total violation-to-outcome classification over the frozen 36-rule WP3 crosswalk.",
      "conditional": false
    },
    {
      "rule_id": "IPEC.RULE.RESIDUAL.001",
      "theorem_id": "T124",
      "on_violation_outcome": "REJECTED_LIVE_RESIDUAL",
      "binding_basis": "WP4 total violation-to-outcome classification over the frozen 36-rule WP3 crosswalk.",
      "conditional": false
    },
    {
      "rule_id": "IPEC.RULE.OBSERVER.001",
      "theorem_id": "T125",
      "on_violation_outcome": "REJECTED_GUARD_FAILURE",
      "binding_basis": "WP4 total violation-to-outcome classification over the frozen 36-rule WP3 crosswalk.",
      "conditional": false
    },
    {
      "rule_id": "IPEC.RULE.FIREWALL.001",
      "theorem_id": "T126",
      "on_violation_outcome": "REJECTED_BRANCH_PROMOTION",
      "binding_basis": "WP4 total violation-to-outcome classification over the frozen 36-rule WP3 crosswalk.",
      "conditional": false
    },
    {
      "rule_id": "IPEC.RULE.CLOSURE.001",
      "theorem_id": "T127",
      "on_violation_outcome": "REJECTED_GUARD_FAILURE",
      "binding_basis": "WP4 total violation-to-outcome classification over the frozen 36-rule WP3 crosswalk.",
      "conditional": false
    },
    {
      "rule_id": "IPEC.RULE.SUPPORT.001",
      "theorem_id": "T128",
      "on_violation_outcome": "REJECTED_GUARD_FAILURE",
      "binding_basis": "WP4 total violation-to-outcome classification over the frozen 36-rule WP3 crosswalk.",
      "conditional": false
    },
    {
      "rule_id": "IPEC.RULE.COMPATIBILITY.001",
      "theorem_id": "T129",
      "on_violation_outcome": "REJECTED_GUARD_FAILURE",
      "binding_basis": "WP4 total violation-to-outcome classification over the frozen 36-rule WP3 crosswalk.",
      "conditional": false
    },
    {
      "rule_id": "IPEC.RULE.READINESS.001",
      "theorem_id": "T130",
      "on_violation_outcome": "REJECTED_GUARD_FAILURE",
      "binding_basis": "WP4 total violation-to-outcome classification over the frozen 36-rule WP3 crosswalk.",
      "conditional": false
    },
    {
      "rule_id": "IPEC.RULE.DOMAIN.001",
      "theorem_id": "T131",
      "on_violation_outcome": "REJECTED_GUARD_FAILURE",
      "binding_basis": "WP4 total violation-to-outcome classification over the frozen 36-rule WP3 crosswalk.",
      "conditional": false
    },
    {
      "rule_id": "IPEC.RULE.DLE.002",
      "theorem_id": "T132",
      "on_violation_outcome": "REJECTED_DLE_FAILURE",
      "binding_basis": "WP4 total violation-to-outcome classification over the frozen 36-rule WP3 crosswalk.",
      "conditional": false
    },
    {
      "rule_id": "IPEC.RULE.TOKEN.001",
      "theorem_id": "T133",
      "on_violation_outcome": "REJECTED_GUARD_FAILURE",
      "binding_basis": "WP4 total violation-to-outcome classification over the frozen 36-rule WP3 crosswalk.",
      "conditional": false
    },
    {
      "rule_id": "IPEC.RULE.RESIDUAL.002",
      "theorem_id": "T134",
      "on_violation_outcome": "REJECTED_LIVE_RESIDUAL",
      "binding_basis": "WP4 total violation-to-outcome classification over the frozen 36-rule WP3 crosswalk.",
      "conditional": false
    },
    {
      "rule_id": "IPEC.RULE.RESIDUAL.003",
      "theorem_id": "T135",
      "on_violation_outcome": "REJECTED_NONELIM_OBSTRUCTION",
      "binding_basis": "WP4 total violation-to-outcome classification over the frozen 36-rule WP3 crosswalk.",
      "conditional": false
    },
    {
      "rule_id": "IPEC.RULE.FIREWALL.002",
      "theorem_id": "T136",
      "on_violation_outcome": "REJECTED_BRANCH_PROMOTION",
      "binding_basis": "WP4 total violation-to-outcome classification over the frozen 36-rule WP3 crosswalk.",
      "conditional": false
    },
    {
      "rule_id": "IPEC.RULE.FIREWALL.003",
      "theorem_id": "T137",
      "on_violation_outcome": "REJECTED_BRANCH_PROMOTION",
      "binding_basis": "WP4 total violation-to-outcome classification over the frozen 36-rule WP3 crosswalk.",
      "conditional": false
    },
    {
      "rule_id": "IPEC.RULE.OBSERVER.002",
      "theorem_id": "T138",
      "on_violation_outcome": "REJECTED_GUARD_FAILURE",
      "binding_basis": "WP4 total violation-to-outcome classification over the frozen 36-rule WP3 crosswalk.",
      "conditional": false
    },
    {
      "rule_id": "IPEC.RULE.ARCHIVE.001",
      "theorem_id": "T139",
      "on_violation_outcome": "REJECTED_GUARD_FAILURE",
      "binding_basis": "WP4 total violation-to-outcome classification over the frozen 36-rule WP3 crosswalk.",
      "conditional": false
    },
    {
      "rule_id": "IPEC.RULE.WITNESS.001",
      "theorem_id": "T140",
      "on_violation_outcome": "REJECTED_GUARD_FAILURE",
      "binding_basis": "WP4 total violation-to-outcome classification over the frozen 36-rule WP3 crosswalk.",
      "conditional": true
    },
    {
      "rule_id": "IPEC.RULE.CONTAINMENT.001",
      "theorem_id": "T141",
      "on_violation_outcome": "REJECTED_BRANCH_PROMOTION",
      "binding_basis": "WP4 total violation-to-outcome classification over the frozen 36-rule WP3 crosswalk.",
      "conditional": false
    },
    {
      "rule_id": "IPEC.RULE.BRANCH.001",
      "theorem_id": "T142",
      "on_violation_outcome": "REJECTED_BRANCH_PROMOTION",
      "binding_basis": "WP4 total violation-to-outcome classification over the frozen 36-rule WP3 crosswalk.",
      "conditional": false
    },
    {
      "rule_id": "IPEC.RULE.CARDINALITY.001",
      "theorem_id": "T143",
      "on_violation_outcome": "REJECTED_GUARD_FAILURE",
      "binding_basis": "WP4 total violation-to-outcome classification over the frozen 36-rule WP3 crosswalk.",
      "conditional": false
    },
    {
      "rule_id": "IPEC.RULE.DIAGNOSTIC.001",
      "theorem_id": "T144",
      "on_violation_outcome": "REJECTED_GUARD_FAILURE",
      "binding_basis": "WP4 total violation-to-outcome classification over the frozen 36-rule WP3 crosswalk.",
      "conditional": false
    },
    {
      "rule_id": "IPEC.RULE.CANONICAL.001",
      "theorem_id": "T145",
      "on_violation_outcome": "INCONCLUSIVE_UNSUPPORTED_FRAGMENT",
      "binding_basis": "WP4 total violation-to-outcome classification over the frozen 36-rule WP3 crosswalk.",
      "conditional": false
    },
    {
      "rule_id": "IPEC.RULE.CANONICAL.002",
      "theorem_id": "T146",
      "on_violation_outcome": "INCONCLUSIVE_UNSUPPORTED_FRAGMENT",
      "binding_basis": "WP4 total violation-to-outcome classification over the frozen 36-rule WP3 crosswalk.",
      "conditional": false
    },
    {
      "rule_id": "IPEC.RULE.REPLAY.001",
      "theorem_id": "T147",
      "on_violation_outcome": "INCONCLUSIVE_UNSUPPORTED_FRAGMENT",
      "binding_basis": "WP4 total violation-to-outcome classification over the frozen 36-rule WP3 crosswalk.",
      "conditional": false
    },
    {
      "rule_id": "IPEC.RULE.MIGRATION.001",
      "theorem_id": "T148",
      "on_violation_outcome": "INCONCLUSIVE_UNSUPPORTED_FRAGMENT",
      "binding_basis": "WP4 total violation-to-outcome classification over the frozen 36-rule WP3 crosswalk.",
      "conditional": false
    },
    {
      "rule_id": "IPEC.RULE.PARITY.001",
      "theorem_id": "T149",
      "on_violation_outcome": "BACKEND_PARITY_FAILURE",
      "binding_basis": "WP4 total violation-to-outcome classification over the frozen 36-rule WP3 crosswalk.",
      "conditional": false
    },
    {
      "rule_id": "IPEC.RULE.SOUNDNESS.001",
      "theorem_id": "T150",
      "on_violation_outcome": "INCONCLUSIVE_UNSUPPORTED_FRAGMENT",
      "binding_basis": "WP4 total violation-to-outcome classification over the frozen 36-rule WP3 crosswalk.",
      "conditional": true
    },
    {
      "rule_id": "IPEC.RULE.EXTENSION.001",
      "theorem_id": "T151",
      "on_violation_outcome": "INCONCLUSIVE_UNSUPPORTED_FRAGMENT",
      "binding_basis": "WP4 total violation-to-outcome classification over the frozen 36-rule WP3 crosswalk.",
      "conditional": false
    },
    {
      "rule_id": "IPEC.RULE.VOCABULARY.001",
      "theorem_id": "T152",
      "on_violation_outcome": "INCONCLUSIVE_UNSUPPORTED_FRAGMENT",
      "binding_basis": "WP4 total violation-to-outcome classification over the frozen 36-rule WP3 crosswalk.",
      "conditional": false
    },
    {
      "rule_id": "IPEC.RULE.DIAGNOSTIC.002",
      "theorem_id": "T153",
      "on_violation_outcome": "INCONCLUSIVE_UNSUPPORTED_FRAGMENT",
      "binding_basis": "WP4 total violation-to-outcome classification over the frozen 36-rule WP3 crosswalk.",
      "conditional": false
    },
    {
      "rule_id": "IPEC.RULE.PROVENANCE.001",
      "theorem_id": "T154",
      "on_violation_outcome": "INCONCLUSIVE_UNSUPPORTED_FRAGMENT",
      "binding_basis": "WP4 total violation-to-outcome classification over the frozen 36-rule WP3 crosswalk.",
      "conditional": false
    },
    {
      "rule_id": "IPEC.RULE.VERSION.001",
      "theorem_id": "T155",
      "on_violation_outcome": "INCONCLUSIVE_UNSUPPORTED_FRAGMENT",